Unique Identifier,Agenda Number,Meeting,Meeting Date,Category,Outcome,Vote,Sumbul Siddiqui,Alanna Mallon,Burhan Azeem,Dennis J. Carlone,Marc C. McGovern,Patricia Nolan,E. Denise Simmons,Paul F. Toner,Quinton Zondervan,Link,Description,Notes
RES 2023 #11,11,01/09/23 Regular,01/09/23,Death Resolution,Adopted,8-0-1,yes,yes,yes,absent,yes,yes,yes,yes,yes,https://cambridgema.iqm2.com/Citizens/Detail_LegiFile.aspx?Frame=&MeetingID=4248&MediaPosition=&ID=17853&CssClass=,Resolution on the death of Helen Ellison.,
RES 2023 #12,12,01/09/23 Regular,01/09/23,Death Resolution,Adopted,8-0-1,yes,yes,yes,absent,yes,yes,yes,yes,yes,https://cambridgema.iqm2.com/Citizens/Detail_LegiFile.aspx?Frame=&MeetingID=4248&MediaPosition=&ID=17854&CssClass=,Resolution on the death of John D. Thompson.,
RES 2023 #13,13,01/09/23 Regular,01/09/23,Resolution,Adopted,8-0-1,yes,yes,yes,absent,yes,yes,yes,yes,yes,https://cambridgema.iqm2.com/Citizens/Detail_LegiFile.aspx?Frame=&MeetingID=4248&MediaPosition=&ID=17857&CssClass=,"Dr. Martin Luther King, Jr. Day",
RES 2023 #14,14,01/09/23 Regular,01/09/23,Death Resolution,Adopted,8-0-1,yes,yes,yes,absent,yes,yes,yes,yes,yes,https://cambridgema.iqm2.com/Citizens/Detail_LegiFile.aspx?Frame=&MeetingID=4248&MediaPosition=&ID=17859&CssClass=,Resolution on the death of Michael J. Galgay.,
RES 2023 #15,15,01/09/23 Regular,01/09/23,Death Resolution,Adopted,8-0-1,yes,yes,yes,absent,yes,yes,yes,yes,yes,https://cambridgema.iqm2.com/Citizens/Detail_LegiFile.aspx?Frame=&MeetingID=4248&MediaPosition=&ID=17861&CssClass=,Resolution on the death of Ramon W. McCree.,
RES 2023 #16,16,01/09/23 Regular,01/09/23,Death Resolution,Adopted,8-0-1,yes,yes,yes,absent,yes,yes,yes,yes,yes,https://cambridgema.iqm2.com/Citizens/Detail_LegiFile.aspx?Frame=&MeetingID=4248&MediaPosition=&ID=17862&CssClass=,Resolution on the death of Kevin O'Rourke.,
RES 2023 #17,17,01/09/23 Regular,01/09/23,Death Resolution,Adopted,8-0-1,yes,yes,yes,absent,yes,yes,yes,yes,yes,https://cambridgema.iqm2.com/Citizens/Detail_LegiFile.aspx?Frame=&MeetingID=4248&MediaPosition=&ID=17864&CssClass=,Resolution on the death of Antonio L. Pacheco.,
RES 2023 #18,18,01/09/23 Regular,01/09/23,Death Resolution,Adopted,8-0-1,yes,yes,yes,absent,yes,yes,yes,yes,yes,https://cambridgema.iqm2.com/Citizens/Detail_LegiFile.aspx?Frame=&MeetingID=4248&MediaPosition=&ID=17866&CssClass=,Resolution on the death of Maria G. DeGregorio.,
RES 2023 #19,19,01/09/23 Regular,01/09/23,Death Resolution,Adopted as Amended,9-0-0,yes,yes,yes,yes,yes,yes,yes,yes,yes,https://cambridgema.iqm2.com/Citizens/Detail_LegiFile.aspx?Frame=&MeetingID=4248&MediaPosition=&ID=17877&CssClass=,Resolution on the death of Kathleen Walcott,
RES 2023 #20,1,01/23/23 Regular,01/23/23,Congratulations,Adopted,9-0-0,yes,yes,yes,yes,yes,yes,yes,yes,yes,https://cambridgema.iqm2.com/Citizens/Detail_LegiFile.aspx?Frame=&MeetingID=4249&MediaPosition=&ID=17515&CssClass=,Congratulations to Jose Rodriguez on his retirement from the Department of Public Works.,
RES 2023 #21,2,01/23/23 Regular,01/23/23,Congratulations,Adopted as Amended,8-0-1,yes,yes,yes,yes,yes,yes,yes,yes,absent,https://cambridgema.iqm2.com/Citizens/Detail_LegiFile.aspx?Frame=&MeetingID=4249&MediaPosition=&ID=17702&CssClass=,Congratulations to Jean Bracken on her retirement from the Department of Public Works.,
RES 2023 #22,3,01/23/23 Regular,01/23/23,Congratulations,Adopted,9-0-0,yes,yes,yes,yes,yes,yes,yes,yes,yes,https://cambridgema.iqm2.com/Citizens/Detail_LegiFile.aspx?Frame=&MeetingID=4249&MediaPosition=&ID=17769&CssClass=,Congratulations to William Connell on his retirement from the Water Department.,
RES 2023 #23,4,01/23/23 Regular,01/23/23,Death Resolution,Adopted,9-0-0,yes,yes,yes,yes,yes,yes,yes,yes,yes,https://cambridgema.iqm2.com/Citizens/Detail_LegiFile.aspx?Frame=&MeetingID=4249&MediaPosition=&ID=17869&CssClass=,"Resolution on the death of George E. Pitts, Sr.",
RES 2023 #24,5,01/23/23 Regular,01/23/23,Death Resolution,Adopted,9-0-0,yes,yes,yes,yes,yes,yes,yes,yes,yes,https://cambridgema.iqm2.com/Citizens/Detail_LegiFile.aspx?Frame=&MeetingID=4249&MediaPosition=&ID=17870&CssClass=,Resolution on the death of Patrick Corcoran.,
RES 2023 #25,6,01/23/23 Regular,01/23/23,Death Resolution,Adopted,9-0-0,yes,yes,yes,yes,yes,yes,yes,yes,yes,https://cambridgema.iqm2.com/Citizens/Detail_LegiFile.aspx?Frame=&MeetingID=4249&MediaPosition=&ID=17871&CssClass=,Resolution on the death of Leonard J. Savignano.,
RES 2023 #26,7,01/23/23 Regular,01/23/23,Death Resolution,Adopted,9-0-0,yes,yes,yes,yes,yes,yes,yes,yes,yes,https://cambridgema.iqm2.com/Citizens/Detail_LegiFile.aspx?Frame=&MeetingID=4249&MediaPosition=&ID=17873&CssClass=,Resolution on the death of Jeffrey Mark Friedman.,
RES 2023 #27,8,01/23/23 Regular,01/23/23,Death Resolution,Adopted,9-0-0,yes,yes,yes,yes,yes,yes,yes,yes,yes,https://cambridgema.iqm2.com/Citizens/Detail_LegiFile.aspx?Frame=&MeetingID=4249&MediaPosition=&ID=17874&CssClass=,Resolution on the death of Susan A. Lawlor.,
RES 2023 #28,9,01/23/23 Regular,01/23/23,Death Resolution,Adopted,9-0-0,yes,yes,yes,yes,yes,yes,yes,yes,yes,https://cambridgema.iqm2.com/Citizens/Detail_LegiFile.aspx?Frame=&MeetingID=4249&MediaPosition=&ID=17875&CssClass=,Resolution on the death of Brian F. Kelly.,
RES 2023 #29,10,01/23/23 Regular,01/23/23,Congratulations,Adopted,9-0-0,yes,yes,yes,yes,yes,yes,yes,yes,yes,https://cambridgema.iqm2.com/Citizens/Detail_LegiFile.aspx?Frame=&MeetingID=4249&MediaPosition=&ID=17915&CssClass=,Congratulations on the Retirement of Janet Izquierdo,
RES 2023 #30,11,01/23/23 Regular,01/23/23,Congratulations,Adopted,9-0-0,yes,yes,yes,yes,yes,yes,yes,yes,yes,https://cambridgema.iqm2.com/Citizens/Detail_LegiFile.aspx?Frame=&MeetingID=4249&MediaPosition=&ID=17919&CssClass=,Congratulations on the Retirement of Jeffrey Turner,
RES 2023 #31,12,01/23/23 Regular,01/23/23,Congratulations,Adopted,9-0-0,yes,yes,yes,yes,yes,yes,yes,yes,yes,https://cambridgema.iqm2.com/Citizens/Detail_LegiFile.aspx?Frame=&MeetingID=4249&MediaPosition=&ID=17921&CssClass=,Congratulations on the Retirement of Lieutenant Stephen Boyle,
RES 2023 #32,13,01/23/23 Regular,01/23/23,Death Resolution,Adopted,9-0-0,yes,yes,yes,yes,yes,yes,yes,yes,yes,https://cambridgema.iqm2.com/Citizens/Detail_LegiFile.aspx?Frame=&MeetingID=4249&MediaPosition=&ID=17922&CssClass=,Resolution on the death of Rocco DiBiase.,
RES 2023 #33,14,01/23/23 Regular,01/23/23,Death Resolution,Adopted,9-0-0,yes,yes,yes,yes,yes,yes,yes,yes,yes,https://cambridgema.iqm2.com/Citizens/Detail_LegiFile.aspx?Frame=&MeetingID=4249&MediaPosition=&ID=17944&CssClass=,Resolution on the death of Dr. Melvin Simms.,
RES 2023 #34,15,01/23/23 Regular,01/23/23,Congratulations,Adopted,9-0-0,yes,yes,yes,yes,yes,yes,yes,yes,yes,https://cambridgema.iqm2.com/Citizens/Detail_LegiFile.aspx?Frame=&MeetingID=4249&MediaPosition=&ID=17951&CssClass=,Congratulations on the Retirement of Firefighter Peter Mickiewicz from the Cambridge Fire Department,
RES 2023 #35,16,01/23/23 Regular,01/23/23,Congratulations,Adopted,9-0-0,yes,yes,yes,yes,yes,yes,yes,yes,yes,https://cambridgema.iqm2.com/Citizens/Detail_LegiFile.aspx?Frame=&MeetingID=4249&MediaPosition=&ID=17976&CssClass=,Congratulations to Jason Targoff for his achievements as the United States Youth Soccer National Volunteer of the Year.,
RES 2023 #36,17,01/23/23 Regular,01/23/23,Congratulations,Adopted,9-0-0,yes,yes,yes,yes,yes,yes,yes,yes,yes,https://cambridgema.iqm2.com/Citizens/Detail_LegiFile.aspx?Frame=&MeetingID=4249&MediaPosition=&ID=17978&CssClass=,Congratulations to Ruth Erickson on her exhibit at The Institute of Contemporary Art in Boston titled “To Begin Again: Artists and Childhood”.,
RES 2023 #37,18,01/23/23 Regular,01/23/23,Death Resolution,Adopted,9-0-0,yes,yes,yes,yes,yes,yes,yes,yes,yes,https://cambridgema.iqm2.com/Citizens/Detail_LegiFile.aspx?Frame=&MeetingID=4249&MediaPosition=&ID=17985&CssClass=,Condolences To The Family of Emma Watkins,
RES 2023 #38,19,01/23/23 Regular,01/23/23,Happy Birthday Resolution,Adopted,9-0-0,yes,yes,yes,yes,yes,yes,yes,yes,yes,https://cambridgema.iqm2.com/Citizens/Detail_LegiFile.aspx?Frame=&MeetingID=4249&MediaPosition=&ID=17986&CssClass=,Happy Birthday to Dr. Estelle Disch,
RES 2023 #39,20,01/23/23 Regular,01/23/23,Retirement Resolution,Adopted,9-0-0,yes,yes,yes,yes,yes,yes,yes,yes,yes,https://cambridgema.iqm2.com/Citizens/Detail_LegiFile.aspx?Frame=&MeetingID=4249&MediaPosition=&ID=17988&CssClass=,Retirement of Ranjit Singanayagam,
RES 2023 #40,21,01/23/23 Regular,01/23/23,Congratulations,Adopted,9-0-0,yes,yes,yes,yes,yes,yes,yes,yes,yes,https://cambridgema.iqm2.com/Citizens/Detail_LegiFile.aspx?Frame=&MeetingID=4249&MediaPosition=&ID=17989&CssClass=,"Congratulations to Julia Mateus, Marisa Da Cosa, Sophie Costa, Stephanie De Carvalho, Marina Do Carmo and Ana Luisa Silva on receiving the 2023 Dr. Leitao Memorial Scholarship Fund",
RES 2023 #41,1,02/06/23 Regular,02/06/23,Congratulations,Adopted,7-0-2,yes,yes,absent,absent,yes,yes,yes,yes,yes,https://cambridgema.iqm2.com/Citizens/Detail_LegiFile.aspx?Frame=&MeetingID=4251&MediaPosition=&ID=17771&CssClass=,Congratulations to Stephen Lyons on his retirement from the Cambridge Police Department.,
RES 2023 #42,2,02/06/23 Regular,02/06/23,Congratulations,Adopted,7-0-2,yes,yes,absent,absent,yes,yes,yes,yes,yes,https://cambridgema.iqm2.com/Citizens/Detail_LegiFile.aspx?Frame=&MeetingID=4251&MediaPosition=&ID=17912&CssClass=,Congratulations to Janet Borron on her retirement from the City of Cambridge.,
RES 2023 #43,3,02/06/23 Regular,02/06/23,Congratulations,Adopted,7-0-2,yes,yes,absent,absent,yes,yes,yes,yes,yes,https://cambridgema.iqm2.com/Citizens/Detail_LegiFile.aspx?Frame=&MeetingID=4251&MediaPosition=&ID=17987&CssClass=,Congratulations to Dirty Water Fitness on its Grand Re-Opening and Expansion.,
RES 2023 #44,4,02/06/23 Regular,02/06/23,Death Resolution,Adopted,7-0-2,yes,yes,absent,absent,yes,yes,yes,yes,yes,https://cambridgema.iqm2.com/Citizens/Detail_LegiFile.aspx?Frame=&MeetingID=4251&MediaPosition=&ID=18026&CssClass=,"Resolution on the death of Norman A. Smith, Sr.",
RES 2023 #45,5,02/06/23 Regular,02/06/23,Congratulations,Adopted,7-0-2,yes,yes,absent,absent,yes,yes,yes,yes,yes,https://cambridgema.iqm2.com/Citizens/Detail_LegiFile.aspx?Frame=&MeetingID=4251&MediaPosition=&ID=18027&CssClass=,Congratulations to Chef Robert Harris and Season to Taste on its Grand Re-Opening.,
RES 2023 #46,6,02/06/23 Regular,02/06/23,Death Resolution,Adopted,7-0-2,yes,yes,absent,absent,yes,yes,yes,yes,yes,https://cambridgema.iqm2.com/Citizens/Detail_LegiFile.aspx?Frame=&MeetingID=4251&MediaPosition=&ID=18050&CssClass=,Resolution on the death of Louise M. Kennedy.,
RES 2023 #47,7,02/06/23 Regular,02/06/23,Death Resolution,Adopted,7-0-2,yes,yes,absent,absent,yes,yes,yes,yes,yes,https://cambridgema.iqm2.com/Citizens/Detail_LegiFile.aspx?Frame=&MeetingID=4251&MediaPosition=&ID=18066&CssClass=,Condolences to the family of Shirley Kimbrough.,
RES 2023 #48,8,02/06/23 Regular,02/06/23,Death Resolution,Adopted,7-0-2,yes,yes,absent,absent,yes,yes,yes,yes,yes,https://cambridgema.iqm2.com/Citizens/Detail_LegiFile.aspx?Frame=&MeetingID=4251&MediaPosition=&ID=18067&CssClass=,"Resolution on the death of William ""Bill"" Lee.",
RES 2023 #49,9,02/06/23 Regular,02/06/23,Death Resolution,Adopted,7-0-2,yes,yes,absent,absent,yes,yes,yes,yes,yes,https://cambridgema.iqm2.com/Citizens/Detail_LegiFile.aspx?Frame=&MeetingID=4251&MediaPosition=&ID=18079&CssClass=,Resolution on the death of Marion Freeman.,
RES 2023 #50,10,02/06/23 Regular,02/06/23,Congratulations,Adopted,7-0-2,yes,yes,absent,absent,yes,yes,yes,yes,yes,https://cambridgema.iqm2.com/Citizens/Detail_LegiFile.aspx?Frame=&MeetingID=4251&MediaPosition=&ID=18088&CssClass=,"Congratulations to Ilyon Woo on the occasion of the publishing of her second book titled ""Master Slave Husband Wife.""",
RES 2023 #51,11,02/06/23 Regular,02/06/23,Congratulations,Adopted,7-0-2,yes,yes,absent,absent,yes,yes,yes,yes,yes,https://cambridgema.iqm2.com/Citizens/Detail_LegiFile.aspx?Frame=&MeetingID=4251&MediaPosition=&ID=18092&CssClass=,Congratulations to the Prospect Hill Academy and Community Charter School of Cambridge of being awarded the 2022 AP Computer Science Female Diversity Award.,
RES 2023 #52,12,02/06/23 Regular,02/06/23,Congratulations,Adopted,7-0-2,yes,yes,absent,absent,yes,yes,yes,yes,yes,https://cambridgema.iqm2.com/Citizens/Detail_LegiFile.aspx?Frame=&MeetingID=4251&MediaPosition=&ID=18097&CssClass=,Congratulations to Julia Hallman and Aaron Rubin on their purchase of Formaggio Kitchen.,
RES 2023 #53,13,02/06/23 Regular,02/06/23,Death Resolution,Adopted,7-0-2,yes,yes,absent,absent,yes,yes,yes,yes,yes,https://cambridgema.iqm2.com/Citizens/Detail_LegiFile.aspx?Frame=&MeetingID=4251&MediaPosition=&ID=18100&CssClass=,Resolution on the death of Alice Wolf.,
RES 2023 #54,14,02/06/23 Regular,02/06/23,Congratulations,Adopted,7-0-2,yes,yes,absent,absent,yes,yes,yes,yes,yes,https://cambridgema.iqm2.com/Citizens/Detail_LegiFile.aspx?Frame=&MeetingID=4251&MediaPosition=&ID=18132&CssClass=,Congratulations To 37th Annual NAACP Brunch Honorees,
RES 2023 #55,15,02/06/23 Regular,02/06/23,Death Resolution,Adopted,7-0-2,yes,yes,absent,absent,yes,yes,yes,yes,yes,https://cambridgema.iqm2.com/Citizens/Detail_LegiFile.aspx?Frame=&MeetingID=4251&MediaPosition=&ID=18217&CssClass=,That the City Council formally go on record in expressing its deepest condolences to the family of Jane Richards for their tremendous loss.,
RES 2023 #56,1,02/13/23 Regular,02/13/23,Death Resolution,Adopted,9-0-0,yes,yes,yes,yes,yes,yes,yes,yes,yes,https://cambridgema.iqm2.com/Citizens/Detail_LegiFile.aspx?Frame=&MeetingID=4252&MediaPosition=&ID=18131&CssClass=,"Resolution on the death of Camille M. ""Cammy"" Fournier.",
RES 2023 #57,2,02/13/23 Regular,02/13/23,Death Resolution,Adopted as Amended,9-0-0,yes,yes,yes,yes,yes,yes,yes,yes,yes,https://cambridgema.iqm2.com/Citizens/Detail_LegiFile.aspx?Frame=&MeetingID=4252&MediaPosition=&ID=18080&CssClass=,Resolution on the death of Edna Dorothy Powers.,
RES 2023 #58,3,02/13/23 Regular,02/13/23,Congratulations,Adopted,9-0-0,yes,yes,yes,yes,yes,yes,yes,yes,yes,https://cambridgema.iqm2.com/Citizens/Detail_LegiFile.aspx?Frame=&MeetingID=4252&MediaPosition=&ID=18143&CssClass=,Congratulations to Lieutenant Buckowe Yam on his promotion to Deputy Superintendent.,
RES 2023 #59,4,02/13/23 Regular,02/13/23,Congratulations,Adopted,9-0-0,yes,yes,yes,yes,yes,yes,yes,yes,yes,https://cambridgema.iqm2.com/Citizens/Detail_LegiFile.aspx?Frame=&MeetingID=4252&MediaPosition=&ID=18264&CssClass=,Congratulations to Captain Vinroy L. Paul on his promotion to Deputy Fire Chief of the City of Cambridge.,
RES 2023 #60,5,02/13/23 Regular,02/13/23,Congratulations,Adopted,9-0-0,yes,yes,yes,yes,yes,yes,yes,yes,yes,https://cambridgema.iqm2.com/Citizens/Detail_LegiFile.aspx?Frame=&MeetingID=4252&MediaPosition=&ID=18268&CssClass=,Congratulations to Fire Captain Marvin E. Ramos on his promotion.,
RES 2023 #61,6,02/13/23 Regular,02/13/23,Congratulations,Adopted,9-0-0,yes,yes,yes,yes,yes,yes,yes,yes,yes,https://cambridgema.iqm2.com/Citizens/Detail_LegiFile.aspx?Frame=&MeetingID=4252&MediaPosition=&ID=18269&CssClass=,Congratulations to Cambridge Fire Lieutenant Ryan T. Murphy on his promotion.,
RES 2023 #62,7,02/13/23 Regular,02/13/23,Congratulations,Adopted as Amended,9-0-0,yes,yes,yes,yes,yes,yes,yes,yes,yes,https://cambridgema.iqm2.com/Citizens/Detail_LegiFile.aspx?Frame=&MeetingID=4252&MediaPosition=&ID=18308&CssClass=,Congratulations to Scott Cody for being inducted into the Massachusetts State Track Coaches Association.,
RES 2023 #63,8,02/13/23 Regular,02/13/23,Congratulations,Adopted as Amended,9-0-0,yes,yes,yes,yes,yes,yes,yes,yes,yes,https://cambridgema.iqm2.com/Citizens/Detail_LegiFile.aspx?Frame=&MeetingID=4252&MediaPosition=&ID=18310&CssClass=,Congratulations to Jamalh Prince for being inducted into the Massachusetts State Track Coaches Association.,
RES 2023 #64,1,02/27/23 Regular,02/27/23,Death Resolution,Adopted,8-0-1,yes,yes,yes,absent,yes,yes,yes,yes,yes,https://cambridgema.iqm2.com/Citizens/Detail_LegiFile.aspx?Frame=&MeetingID=4253&MediaPosition=&ID=18272&CssClass=,Resolution on the death of Eileen M. DeLouchrey,
RES 2023 #65,2,02/27/23 Regular,02/27/23,Death Resolution,Adopted,8-0-1,yes,yes,yes,absent,yes,yes,yes,yes,yes,https://cambridgema.iqm2.com/Citizens/Detail_LegiFile.aspx?Frame=&MeetingID=4253&MediaPosition=&ID=18416&CssClass=,Resolution on the death of Reverend Rodney Dailey.,
RES 2023 #66,3,02/27/23 Regular,02/27/23,Death Resolution,Adopted as Amended,8-0-1,yes,yes,yes,absent,yes,yes,yes,yes,yes,https://cambridgema.iqm2.com/Citizens/Detail_LegiFile.aspx?Frame=&MeetingID=4253&MediaPosition=&ID=18427&CssClass=,Resolution on the death of Marion A. (Colarusso) Sullivan.,
RES 2023 #67,4,02/27/23 Regular,02/27/23,Happy Birthday Resolution,Adopted,8-0-1,yes,yes,yes,absent,yes,yes,yes,yes,yes,https://cambridgema.iqm2.com/Citizens/Detail_LegiFile.aspx?Frame=&MeetingID=4253&MediaPosition=&ID=18430&CssClass=,Happy 85th Birthday wishes to Patricia Dottin Taylor.,
RES 2023 #68,5,02/27/23 Regular,02/27/23,Retirement Resolution,Adopted,8-0-1,yes,yes,yes,absent,yes,yes,yes,yes,yes,https://cambridgema.iqm2.com/Citizens/Detail_LegiFile.aspx?Frame=&MeetingID=4253&MediaPosition=&ID=18437&CssClass=,Congratulations to Frank W. Atchue on his retirement from the Inspectional Services Department.,
RES 2023 #69,6,02/27/23 Regular,02/27/23,Congratulations,Adopted,8-0-1,yes,yes,yes,absent,yes,yes,yes,yes,yes,https://cambridgema.iqm2.com/Citizens/Detail_LegiFile.aspx?Frame=&MeetingID=4253&MediaPosition=&ID=18461&CssClass=,Congratulations to Helena Wurzel on her solo exhibit at the Praise Shadows Art Gallery.,
RES 2023 #70,7,02/27/23 Regular,02/27/23,Death Resolution,Adopted,8-0-1,yes,yes,yes,absent,yes,yes,yes,yes,yes,https://cambridgema.iqm2.com/Citizens/Detail_LegiFile.aspx?Frame=&MeetingID=4253&MediaPosition=&ID=18464&CssClass=,Resolution on the death of Michael F. Menezes.,
RES 2023 #71,8,02/27/23 Regular,02/27/23,Death Resolution,Adopted,8-0-1,yes,yes,yes,absent,yes,yes,yes,yes,yes,https://cambridgema.iqm2.com/Citizens/Detail_LegiFile.aspx?Frame=&MeetingID=4253&MediaPosition=&ID=18481&CssClass=,Resolution on the death of S. Donald Gonson,
RES 2023 #72,1,03/06/23 Regular,03/06/23,Congratulations,Adopted as Amended,9-0-0,yes,yes,yes,yes,yes,yes,yes,yes,yes,https://cambridgema.iqm2.com/Citizens/Detail_LegiFile.aspx?Frame=&MeetingID=4254&MediaPosition=&ID=17918&CssClass=,Congratulations to Robert Steck on his retirement from the City of Cambridge.,
RES 2023 #73,2,03/06/23 Regular,03/06/23,Congratulations,Adopted,9-0-0,yes,yes,yes,yes,yes,yes,yes,yes,yes,https://cambridgema.iqm2.com/Citizens/Detail_LegiFile.aspx?Frame=&MeetingID=4254&MediaPosition=&ID=18508&CssClass=,That the City Council recognize March as National Social Workers Month.,
RES 2023 #74,3,03/06/23 Regular,03/06/23,Retirement Resolution,Adopted,9-0-0,yes,yes,yes,yes,yes,yes,yes,yes,yes,https://cambridgema.iqm2.com/Citizens/Detail_LegiFile.aspx?Frame=&MeetingID=4254&MediaPosition=&ID=18515&CssClass=,Congratulations to Sam Corda on his retirement from the Cambridge Water Department.,
RES 2023 #75,4,03/06/23 Regular,03/06/23,Death Resolution,Adopted,9-0-0,yes,yes,yes,yes,yes,yes,yes,yes,yes,https://cambridgema.iqm2.com/Citizens/Detail_LegiFile.aspx?Frame=&MeetingID=4254&MediaPosition=&ID=18516&CssClass=,Resolution on the death of David Leslie.,
RES 2023 #76,5,03/06/23 Regular,03/06/23,Death Resolution,Adopted,9-0-0,yes,yes,yes,yes,yes,yes,yes,yes,yes,https://cambridgema.iqm2.com/Citizens/Detail_LegiFile.aspx?Frame=&MeetingID=4254&MediaPosition=&ID=18517&CssClass=,Resolution on the death of Richard John Fitzgerald.,
RES 2023 #77,1,03/20/23 Regular,03/20/23,Congratulations,Adopted,9-0-0,yes,yes,yes,yes,yes,yes,yes,yes,yes,https://cambridgema.iqm2.com/Citizens/Detail_LegiFile.aspx?Frame=&MeetingID=4256&MediaPosition=&ID=18525&CssClass=,Congratulations to Sara Reese on receiving the 2023 Exemplary School Champion Award for her leadership in workforce development in Cambridge.,
RES 2023 #78,2,03/20/23 Regular,03/20/23,Resolution,Adopted,9-0-0,yes,yes,yes,yes,yes,yes,yes,yes,yes,https://cambridgema.iqm2.com/Citizens/Detail_LegiFile.aspx?Frame=&MeetingID=4256&MediaPosition=&ID=18530&CssClass=,Gratitude to Margaret Drury for her many years of tireless service to the Cambridge Redevelopment Authority and to the City of Cambridge.,
RES 2023 #79,3,03/20/23 Regular,03/20/23,Congratulations,Adopted,9-0-0,yes,yes,yes,yes,yes,yes,yes,yes,yes,https://cambridgema.iqm2.com/Citizens/Detail_LegiFile.aspx?Frame=&MeetingID=4256&MediaPosition=&ID=18547&CssClass=,Congratulations to Somerville-Cambridge Elder Services for 50 years of service to the City of Cambridge and its residents.,
RES 2023 #80,4,03/20/23 Regular,03/20/23,Death Resolution,Adopted,9-0-0,yes,yes,yes,yes,yes,yes,yes,yes,yes,https://cambridgema.iqm2.com/Citizens/Detail_LegiFile.aspx?Frame=&MeetingID=4256&MediaPosition=&ID=18697&CssClass=,Condolences To The Family of Annette Williams,
RES 2023 #81,5,03/20/23 Regular,03/20/23,Death Resolution,Adopted,9-0-0,yes,yes,yes,yes,yes,yes,yes,yes,yes,https://cambridgema.iqm2.com/Citizens/Detail_LegiFile.aspx?Frame=&MeetingID=4256&MediaPosition=&ID=18698&CssClass=,Condolences To The Family of Cynthia Roberts,
RES 2023 #82,6,03/20/23 Regular,03/20/23,Happy Birthday Resolution,Adopted,9-0-0,yes,yes,yes,yes,yes,yes,yes,yes,yes,https://cambridgema.iqm2.com/Citizens/Detail_LegiFile.aspx?Frame=&MeetingID=4256&MediaPosition=&ID=18676&CssClass=,Happy 91st Birthday to Moses Moore,
RES 2023 #83,1,04/03/23 Regular,04/03/23,Congratulations,Adopted,9-0-0,yes,yes,yes,yes,yes,yes,yes,yes,yes,https://cambridgema.iqm2.com/Citizens/Detail_LegiFile.aspx?Frame=&MeetingID=4258&MediaPosition=&ID=18385&CssClass=,Congratulations on the retirement of Chandra Banks.,
RES 2023 #84,2,04/03/23 Regular,04/03/23,Death Resolution,Adopted,9-0-0,yes,yes,yes,yes,yes,yes,yes,yes,yes,https://cambridgema.iqm2.com/Citizens/Detail_LegiFile.aspx?Frame=&MeetingID=4258&MediaPosition=&ID=18833&CssClass=,Resolution on the death of Mel King.,
RES 2023 #85,3,04/03/23 Regular,04/03/23,Death Resolution,Adopted,9-0-0,yes,yes,yes,yes,yes,yes,yes,yes,yes,https://cambridgema.iqm2.com/Citizens/Detail_LegiFile.aspx?Frame=&MeetingID=4258&MediaPosition=&ID=18834&CssClass=,Resolution on the death of Alexandre Perry.,
RES 2023 #86,4,04/03/23 Regular,04/03/23,Congratulations,Adopted,9-0-0,yes,yes,yes,yes,yes,yes,yes,yes,yes,https://cambridgema.iqm2.com/Citizens/Detail_LegiFile.aspx?Frame=&MeetingID=4258&MediaPosition=&ID=18835&CssClass=,Congratulations to Ms. Sarah Howard Parker on her film debut.,
RES 2023 #87,5,04/03/23 Regular,04/03/23,Death Resolution,Adopted,9-0-0,yes,yes,yes,yes,yes,yes,yes,yes,yes,https://cambridgema.iqm2.com/Citizens/Detail_LegiFile.aspx?Frame=&MeetingID=4258&MediaPosition=&ID=18836&CssClass=,Resolution on the death of William Younker.,
RES 2023 #88,6,04/03/23 Regular,04/03/23,Congratulations,Adopted,9-0-0,yes,yes,yes,yes,yes,yes,yes,yes,yes,https://cambridgema.iqm2.com/Citizens/Detail_LegiFile.aspx?Frame=&MeetingID=4258&MediaPosition=&ID=18388&CssClass=,Congratulations on the retirement of Gary Melanson from the Cambridge Health Alliance.,
RES 2023 #89,7,04/03/23 Regular,04/03/23,Congratulations,Adopted,9-0-0,yes,yes,yes,yes,yes,yes,yes,yes,yes,https://cambridgema.iqm2.com/Citizens/Detail_LegiFile.aspx?Frame=&MeetingID=4258&MediaPosition=&ID=18392&CssClass=,Congratulations on the retirement of Paul Simonds.,
RES 2023 #90,8,04/03/23 Regular,04/03/23,Congratulations,Adopted,9-0-0,yes,yes,yes,yes,yes,yes,yes,yes,yes,https://cambridgema.iqm2.com/Citizens/Detail_LegiFile.aspx?Frame=&MeetingID=4258&MediaPosition=&ID=18851&CssClass=,Thanks to Shaun Clarke for his devoted work to the Cambridge Community Television Board and his service as MCT Committee Chair and Board Vice President.,
RES 2023 #91,1,04/10/23 Regular,04/10/23,Congratulations,Adopted,8-0-1,yes,yes,yes,yes,absent,yes,yes,yes,yes,https://cambridgema.iqm2.com/Citizens/Detail_LegiFile.aspx?Frame=&MeetingID=4259&MediaPosition=&ID=17513&CssClass=,Congratulations on the retirement of Lieutenant Robert Grey from the Cambridge Police Department.,
RES 2023 #92,2,04/10/23 Regular,04/10/23,Congratulations,Adopted,8-0-1,yes,yes,yes,yes,absent,yes,yes,yes,yes,https://cambridgema.iqm2.com/Citizens/Detail_LegiFile.aspx?Frame=&MeetingID=4259&MediaPosition=&ID=17514&CssClass=,Congratulations on the retirement of Patrol Officer Jerry Jean-Baptiste from the Cambridge Police Department.,
RES 2023 #93,3,04/10/23 Regular,04/10/23,Congratulations,Adopted as Amended,8-0-1,yes,yes,yes,yes,absent,yes,yes,yes,yes,https://cambridgema.iqm2.com/Citizens/Detail_LegiFile.aspx?Frame=&MeetingID=4259&MediaPosition=&ID=17913&CssClass=,Congratulations on the retirement of Lieutenant Thomas Ahern from the Cambridge Police Department.,Add Simmons co sponsor
RES 2023 #94,4,04/10/23 Regular,04/10/23,Congratulations,Adopted as Amended,8-0-1,yes,yes,yes,yes,absent,yes,yes,yes,yes,https://cambridgema.iqm2.com/Citizens/Detail_LegiFile.aspx?Frame=&MeetingID=4259&MediaPosition=&ID=17916&CssClass=,Congratulations on the retirement of Patrol Officer Hercot Miller from the Cambridge Police Department.,Add Simmons co sponsor
RES 2023 #95,5,04/10/23 Regular,04/10/23,Congratulations,Adopted as Amended,8-0-1,yes,yes,yes,yes,absent,yes,yes,yes,yes,https://cambridgema.iqm2.com/Citizens/Detail_LegiFile.aspx?Frame=&MeetingID=4259&MediaPosition=&ID=17920&CssClass=,Congratulations on the retirement of Maureen Van Stry.,Add Simmons co sponsor
