Unique Identifier,Agenda Number,Meeting,Meeting Date,Category,Outcome,Vote,Sumbul Siddiqui,Alanna Mallon,Burhan Azeem,Dennis J. Carlone,Marc C. McGovern,Patricia Nolan,E. Denise Simmons,Paul F. Toner,Quinton Zondervan,Link,Description,Notes
RES 2023 #96,6,04/10/23 Regular,04/10/23,Congratulations,Adopted,8-0-1,yes,yes,yes,yes,absent,yes,yes,yes,yes,https://cambridgema.iqm2.com/Citizens/Detail_LegiFile.aspx?Frame=&MeetingID=4259&MediaPosition=&ID=18386&CssClass=,Congratulations on the Retirement of Sergeant Susan Kale from the Cambridge Police Department.,
RES 2023 #97,7,04/10/23 Regular,04/10/23,Congratulations,Adopted,8-0-1,yes,yes,yes,yes,absent,yes,yes,yes,yes,https://cambridgema.iqm2.com/Citizens/Detail_LegiFile.aspx?Frame=&MeetingID=4259&MediaPosition=&ID=18387&CssClass=,Congratulations on the retirement of Jean Kuropatkin.,
RES 2023 #98,8,04/10/23 Regular,04/10/23,Congratulations,Adopted as Amended,8-0-1,yes,yes,yes,yes,absent,yes,yes,yes,yes,https://cambridgema.iqm2.com/Citizens/Detail_LegiFile.aspx?Frame=&MeetingID=4259&MediaPosition=&ID=18389&CssClass=,Congratulations on the retirement of Debra Morris.,Add Simmons co sponsor
RES 2023 #99,9,04/10/23 Regular,04/10/23,Congratulations,Adopted,8-0-1,yes,yes,yes,yes,absent,yes,yes,yes,yes,https://cambridgema.iqm2.com/Citizens/Detail_LegiFile.aspx?Frame=&MeetingID=4259&MediaPosition=&ID=18390&CssClass=,Congratulations on the retirement of Matilde Santos.,
RES 2023 #100,10,04/10/23 Regular,04/10/23,Congratulations,Adopted,8-0-1,yes,yes,yes,yes,absent,yes,yes,yes,yes,https://cambridgema.iqm2.com/Citizens/Detail_LegiFile.aspx?Frame=&MeetingID=4259&MediaPosition=&ID=18845&CssClass=,Congratulations to Christine Burke on her 50th Birthday.,
RES 2023 #101,11,04/10/23 Regular,04/10/23,Congratulations,Adopted,8-0-1,yes,yes,yes,yes,absent,yes,yes,yes,yes,https://cambridgema.iqm2.com/Citizens/Detail_LegiFile.aspx?Frame=&MeetingID=4259&MediaPosition=&ID=18908&CssClass=,Congratulations on the retirement of Arthur Moy from the Cambridge Fire Department.,
RES 2023 #102,12,04/10/23 Regular,04/10/23,Congratulations,Adopted,8-0-1,yes,yes,yes,yes,absent,yes,yes,yes,yes,https://cambridgema.iqm2.com/Citizens/Detail_LegiFile.aspx?Frame=&MeetingID=4259&MediaPosition=&ID=18910&CssClass=,Congratulations on the retirement of Patrick Quirke.,
RES 2023 #103,13,04/10/23 Regular,04/10/23,Congratulations,Adopted,8-0-1,yes,yes,yes,yes,absent,yes,yes,yes,yes,https://cambridgema.iqm2.com/Citizens/Detail_LegiFile.aspx?Frame=&MeetingID=4259&MediaPosition=&ID=18916&CssClass=,Congratulations on the promotion of Temporary Lieutenant Ameer A. Moustafa from the Cambridge Fire Department.,
RES 2023 #104,14,04/10/23 Regular,04/10/23,Congratulations,Adopted,8-0-1,yes,yes,yes,yes,absent,yes,yes,yes,yes,https://cambridgema.iqm2.com/Citizens/Detail_LegiFile.aspx?Frame=&MeetingID=4259&MediaPosition=&ID=18917&CssClass=,Congratulations on the promotion of Temporary Lieutenant Victor M. Clarke. Jr.  from the Cambridge Fire Department.,
RES 2023 #105,15,04/10/23 Regular,04/10/23,Congratulations,Adopted,8-0-1,yes,yes,yes,yes,absent,yes,yes,yes,yes,https://cambridgema.iqm2.com/Citizens/Detail_LegiFile.aspx?Frame=&MeetingID=4259&MediaPosition=&ID=18918&CssClass=,Congratulations on the promotion of Firefighter Cameron R. Moyer from the Cambridge Fire Department.,
RES 2023 #106,16,04/10/23 Regular,04/10/23,Congratulations,Adopted,8-0-1,yes,yes,yes,yes,absent,yes,yes,yes,yes,https://cambridgema.iqm2.com/Citizens/Detail_LegiFile.aspx?Frame=&MeetingID=4259&MediaPosition=&ID=18921&CssClass=,Congratulations on the promotion of Firefighter William B. Whalen from the Cambridge Fire Department.,
RES 2023 #107,17,04/10/23 Regular,04/10/23,Death Resolution,Adopted,8-0-1,yes,yes,yes,yes,absent,yes,yes,yes,yes,https://cambridgema.iqm2.com/Citizens/Detail_LegiFile.aspx?Frame=&MeetingID=4259&MediaPosition=&ID=18931&CssClass=,Resolution on the death of Ned Handy.,
RES 2023 #108,18,04/10/23 Regular,04/10/23,Death Resolution,Adopted,8-0-1,yes,yes,yes,yes,absent,yes,yes,yes,yes,https://cambridgema.iqm2.com/Citizens/Detail_LegiFile.aspx?Frame=&MeetingID=4259&MediaPosition=&ID=19017&CssClass=,Resolution on the death of Barbara Fox.,
RES 2023 #109,19,04/10/23 Regular,04/10/23,Death Resolution,Adopted,8-0-1,yes,yes,yes,yes,absent,yes,yes,yes,yes,https://cambridgema.iqm2.com/Citizens/Detail_LegiFile.aspx?Frame=&MeetingID=4259&MediaPosition=&ID=19018&CssClass=,Resolution on the death of Annette Kathleen Hyness Eng.,
RES 2023 #110,20,04/10/23 Regular,04/10/23,Congratulations,Adopted,8-0-1,yes,yes,yes,yes,absent,yes,yes,yes,yes,https://cambridgema.iqm2.com/Citizens/Detail_LegiFile.aspx?Frame=&MeetingID=4259&MediaPosition=&ID=19019&CssClass=,Congratulations to Club Recreativo Lusitania on the occasion of the Club's 100th Anniversary.,
RES 2023 #111,21,04/10/23 Regular,04/10/23,Congratulations,Adopted,8-0-1,yes,yes,yes,yes,absent,yes,yes,yes,yes,https://cambridgema.iqm2.com/Citizens/Detail_LegiFile.aspx?Frame=&MeetingID=4259&MediaPosition=&ID=19020&CssClass=,Congratulations to the Cambridge Program's Cambridge Warrior Basketball Team - 6th time Mass State Division 1 Special Olympics Basketball Champions.,
RES 2023 #112,22,04/10/23 Regular,04/10/23,Retirement Resolution,Adopted,8-0-1,yes,yes,yes,yes,absent,yes,yes,yes,yes,https://cambridgema.iqm2.com/Citizens/Detail_LegiFile.aspx?Frame=&MeetingID=4259&MediaPosition=&ID=19036&CssClass=,Thanks to Nancy Woods for her service to the Cambridge Public Library.,
RES 2023 #113,23,04/10/23 Regular,04/10/23,Congratulations,Adopted,8-0-1,yes,yes,yes,yes,absent,yes,yes,yes,yes,https://cambridgema.iqm2.com/Citizens/Detail_LegiFile.aspx?Frame=&MeetingID=4259&MediaPosition=&ID=19037&CssClass=,"Congratulations to the nonprofits working with the City for their commitment and service to Cambridge residents, and urge all citizens to recognize the Community Development Programs and the important role they play in our community.",
RES 2023 #114,1,04/24/23 Regular,04/24/23,Congratulations,Adopted as Amended,9-0-0,yes,yes,yes,yes,yes,yes,yes,yes,yes,https://cambridgema.iqm2.com/Citizens/Detail_LegiFile.aspx?Frame=&MeetingID=4260&MediaPosition=&ID=19061&CssClass=,Congratulations to Bishop Brian C. Greene on receiving the Distinguished Alumnus Award from Cambridge Matignon School.,
RES 2023 #115,2,04/24/23 Regular,04/24/23,Death Resolution,Adopted,9-0-0,yes,yes,yes,yes,yes,yes,yes,yes,yes,https://cambridgema.iqm2.com/Citizens/Detail_LegiFile.aspx?Frame=&MeetingID=4260&MediaPosition=&ID=19079&CssClass=,Resolution on the death of Ruth Hill.,
RES 2023 #116,3,04/24/23 Regular,04/24/23,Congratulations,Adopted,9-0-0,yes,yes,yes,yes,yes,yes,yes,yes,yes,https://cambridgema.iqm2.com/Citizens/Detail_LegiFile.aspx?Frame=&MeetingID=4260&MediaPosition=&ID=18907&CssClass=,Congratulations on the retirement of Diane Bruno from the Cambridge Public Health Commission.,
RES 2023 #117,4,04/24/23 Regular,04/24/23,Congratulations,Adopted,9-0-0,yes,yes,yes,yes,yes,yes,yes,yes,yes,https://cambridgema.iqm2.com/Citizens/Detail_LegiFile.aspx?Frame=&MeetingID=4260&MediaPosition=&ID=18913&CssClass=,Congratulations on the retirement of David Smith from the Department of Public Works.,
RES 2023 #118,5,04/24/23 Regular,04/24/23,Congratulations,Adopted,9-0-0,yes,yes,yes,yes,yes,yes,yes,yes,yes,https://cambridgema.iqm2.com/Citizens/Detail_LegiFile.aspx?Frame=&MeetingID=4260&MediaPosition=&ID=19096&CssClass=,Congratulations to Haitham Mansour for his dedication to Cambridge Youth Soccer.,
RES 2023 #119,6,04/24/23 Regular,04/24/23,Congratulations,Adopted,9-0-0,yes,yes,yes,yes,yes,yes,yes,yes,yes,https://cambridgema.iqm2.com/Citizens/Detail_LegiFile.aspx?Frame=&MeetingID=4260&MediaPosition=&ID=19099&CssClass=,Congratulations to Melissa Carpenito on being named 2022 Police Dispatcher of the Year.,
RES 2023 #120,7,04/24/23 Regular,04/24/23,Congratulations,Adopted,9-0-0,yes,yes,yes,yes,yes,yes,yes,yes,yes,https://cambridgema.iqm2.com/Citizens/Detail_LegiFile.aspx?Frame=&MeetingID=4260&MediaPosition=&ID=19100&CssClass=,Thanks to the Cambridge Public Library team and encourage Cambridge residents to participate in programs and events celebrating National Library Week.,
RES 2023 #121,8,04/24/23 Regular,04/24/23,Congratulations,Adopted,9-0-0,yes,yes,yes,yes,yes,yes,yes,yes,yes,https://cambridgema.iqm2.com/Citizens/Detail_LegiFile.aspx?Frame=&MeetingID=4260&MediaPosition=&ID=19103&CssClass=,Congratulations to Bethany Morrissey on being named 2022 Fire Alarm Operator of the Year.,
RES 2023 #122,9,04/24/23 Regular,04/24/23,Congratulations,Adopted,9-0-0,yes,yes,yes,yes,yes,yes,yes,yes,yes,https://cambridgema.iqm2.com/Citizens/Detail_LegiFile.aspx?Frame=&MeetingID=4260&MediaPosition=&ID=19106&CssClass=,Congratulations to Erica Crane 2022 on being named Communications Training Officer of the Year.,
RES 2023 #123,10,04/24/23 Regular,04/24/23,Congratulations,Adopted,9-0-0,yes,yes,yes,yes,yes,yes,yes,yes,yes,https://cambridgema.iqm2.com/Citizens/Detail_LegiFile.aspx?Frame=&MeetingID=4260&MediaPosition=&ID=19107&CssClass=,Congratulations to Joseph Sullivan on being named 2022 Supervisor of the Year.,
RES 2023 #124,11,04/24/23 Regular,04/24/23,Congratulations,Adopted,9-0-0,yes,yes,yes,yes,yes,yes,yes,yes,yes,https://cambridgema.iqm2.com/Citizens/Detail_LegiFile.aspx?Frame=&MeetingID=4260&MediaPosition=&ID=19110&CssClass=,Congratulations to David Linehan on being named 2022 Emergency Medical Dispatcher of the Year.,
RES 2023 #125,12,04/24/23 Regular,04/24/23,Congratulations,Adopted,9-0-0,yes,yes,yes,yes,yes,yes,yes,yes,yes,https://cambridgema.iqm2.com/Citizens/Detail_LegiFile.aspx?Frame=&MeetingID=4260&MediaPosition=&ID=19055&CssClass=,Congratulations on the 175th Anniversary of St. Peter's Parish,
RES 2023 #126,13,04/24/23 Regular,04/24/23,Death Resolution,Adopted,9-0-0,yes,yes,yes,yes,yes,yes,yes,yes,yes,https://cambridgema.iqm2.com/Citizens/Detail_LegiFile.aspx?Frame=&MeetingID=4260&MediaPosition=&ID=19121&CssClass=,Condolences To The Family of Ramona Paige,
RES 2023 #127,14,04/24/23 Regular,04/24/23,Death Resolution,Adopted,9-0-0,yes,yes,yes,yes,yes,yes,yes,yes,yes,https://cambridgema.iqm2.com/Citizens/Detail_LegiFile.aspx?Frame=&MeetingID=4260&MediaPosition=&ID=19122&CssClass=,"Condolences To The Family of William A. Ridgley, Sr.",
RES 2023 #128,15,04/24/23 Regular,04/24/23,Death Resolution,Adopted as Amended,9-0-0,yes,yes,yes,yes,yes,yes,yes,yes,yes,https://cambridgema.iqm2.com/Citizens/Detail_LegiFile.aspx?Frame=&MeetingID=4260&MediaPosition=&ID=19126&CssClass=,Resolution on the death of John Clifford.,
RES 2023 #129,1,05/01/23 Regular,05/01/23,Congratulations,Adopted,8-0-1,yes,absent,yes,yes,yes,yes,yes,yes,yes,https://cambridgema.iqm2.com/Citizens/Detail_LegiFile.aspx?Frame=&MeetingID=4261&MediaPosition=&ID=19184&CssClass=,"Congratulations to Debra Wise on her appointment as Associate Artistic Director of Revels, Inc.",
RES 2023 #130,1,05/08/23 Regular,05/08/23,Congratulations,Adopted as Amended,9-0-0,yes,yes,yes,yes,yes,yes,yes,yes,yes,https://cambridgema.iqm2.com/Citizens/Detail_LegiFile.aspx?Frame=&MeetingID=4262&MediaPosition=&ID=17389&CssClass=,Congratulations on the Retirement of Julie Craven from The Cambridge Public Schools,
RES 2023 #131,2,05/08/23 Regular,05/08/23,Congratulations,Adopted,9-0-0,yes,yes,yes,yes,yes,yes,yes,yes,yes,https://cambridgema.iqm2.com/Citizens/Detail_LegiFile.aspx?Frame=&MeetingID=4262&MediaPosition=&ID=18524&CssClass=,Congratulations on the Retirement of Candyce Dostert from The Cambridge Public Schools,
RES 2023 #132,3,05/08/23 Regular,05/08/23,Congratulations,Adopted,9-0-0,yes,yes,yes,yes,yes,yes,yes,yes,yes,https://cambridgema.iqm2.com/Citizens/Detail_LegiFile.aspx?Frame=&MeetingID=4262&MediaPosition=&ID=19147&CssClass=,Congratulations on the Retirement of Eric Berggren from The Cambridge Public Schools,
RES 2023 #133,4,05/08/23 Regular,05/08/23,Congratulations,Adopted,9-0-0,yes,yes,yes,yes,yes,yes,yes,yes,yes,https://cambridgema.iqm2.com/Citizens/Detail_LegiFile.aspx?Frame=&MeetingID=4262&MediaPosition=&ID=19148&CssClass=,Congratulations on the Retirement of Ieda Demelo from The Cambridge Health Alliance,
RES 2023 #134,5,05/08/23 Regular,05/08/23,Congratulations,Adopted,9-0-0,yes,yes,yes,yes,yes,yes,yes,yes,yes,https://cambridgema.iqm2.com/Citizens/Detail_LegiFile.aspx?Frame=&MeetingID=4262&MediaPosition=&ID=19150&CssClass=,Congratulations on the Retirement of Frederick Hart,
RES 2023 #135,6,05/08/23 Regular,05/08/23,Congratulations,Adopted,9-0-0,yes,yes,yes,yes,yes,yes,yes,yes,yes,https://cambridgema.iqm2.com/Citizens/Detail_LegiFile.aspx?Frame=&MeetingID=4262&MediaPosition=&ID=19151&CssClass=,Congratulations to Marylou Sullivan on her Retirement from The Cambridge Police Department,
RES 2023 #136,7,05/08/23 Regular,05/08/23,Congratulations,Adopted,9-0-0,yes,yes,yes,yes,yes,yes,yes,yes,yes,https://cambridgema.iqm2.com/Citizens/Detail_LegiFile.aspx?Frame=&MeetingID=4262&MediaPosition=&ID=19152&CssClass=,Congratulations to Gretchen Hardina on her retirement from The Cambridge Public Schools,
RES 2023 #137,8,05/08/23 Regular,05/08/23,Congratulations,Adopted,9-0-0,yes,yes,yes,yes,yes,yes,yes,yes,yes,https://cambridgema.iqm2.com/Citizens/Detail_LegiFile.aspx?Frame=&MeetingID=4262&MediaPosition=&ID=19153&CssClass=,Congratulations to Lieutenant John Lang on his Retirement from The Cambridge Police Department,
RES 2023 #138,9,05/08/23 Regular,05/08/23,Congratulations,Adopted,9-0-0,yes,yes,yes,yes,yes,yes,yes,yes,yes,https://cambridgema.iqm2.com/Citizens/Detail_LegiFile.aspx?Frame=&MeetingID=4262&MediaPosition=&ID=19155&CssClass=,Congratulations to Eileen Walsh on her Retirement from the Cambridge Health Alliance,
RES 2023 #139,10,05/08/23 Regular,05/08/23,Congratulations,Adopted as Amended,9-0-0,yes,yes,yes,yes,yes,yes,yes,yes,yes,https://cambridgema.iqm2.com/Citizens/Detail_LegiFile.aspx?Frame=&MeetingID=4262&MediaPosition=&ID=19293&CssClass=,Congratulations to Cambridge Crossing on receiving the Nicholas Humber Award for Outstanding Collaboration,
RES 2023 #140,11,05/08/23 Regular,05/08/23,Death Resolution,Adopted,9-0-0,yes,yes,yes,yes,yes,yes,yes,yes,yes,https://cambridgema.iqm2.com/Citizens/Detail_LegiFile.aspx?Frame=&MeetingID=4262&MediaPosition=&ID=19295&CssClass=,Resolution on the death of Lillian F. Orchard.,
RES 2023 #141,12,05/08/23 Regular,05/08/23,Death Resolution,Adopted,9-0-0,yes,yes,yes,yes,yes,yes,yes,yes,yes,https://cambridgema.iqm2.com/Citizens/Detail_LegiFile.aspx?Frame=&MeetingID=4262&MediaPosition=&ID=19297&CssClass=,Resolution on the death of Rita A. Carney.,
RES 2023 #142,13,05/08/23 Regular,05/08/23,Congratulations,Adopted,9-0-0,yes,yes,yes,yes,yes,yes,yes,yes,yes,https://cambridgema.iqm2.com/Citizens/Detail_LegiFile.aspx?Frame=&MeetingID=4262&MediaPosition=&ID=19298&CssClass=,Congratulations to the Portugalia Restaurant,
RES 2023 #143,14,05/08/23 Regular,05/08/23,Retirement Resolution,Adopted,9-0-0,yes,yes,yes,yes,yes,yes,yes,yes,yes,https://cambridgema.iqm2.com/Citizens/Detail_LegiFile.aspx?Frame=&MeetingID=4262&MediaPosition=&ID=19343&CssClass=,Retirement of Charlie Parker from Just-A-Start,
RES 2023 #144,15,05/08/23 Regular,05/08/23,Resolution,Adopted,9-0-0,yes,yes,yes,yes,yes,yes,yes,yes,yes,https://cambridgema.iqm2.com/Citizens/Detail_LegiFile.aspx?Frame=&MeetingID=4262&MediaPosition=&ID=19386&CssClass=,Resolution for Teachers Appreciation Week,
RES 2023 #145,1,05/15/23 Regular,05/15/23,Congratulations,Adopted,9-0-0,yes,yes,yes,yes,yes,yes,yes,yes,yes,https://cambridgema.iqm2.com/Citizens/Detail_LegiFile.aspx?Frame=&MeetingID=4263&MediaPosition=&ID=19350&CssClass=,Congratulations to Manny Lopes on receiving the 2023 Massachusetts Alliance of Portuguese Speaker’s Person of the Year Award.,
RES 2023 #146,2,05/15/23 Regular,05/15/23,Congratulations,Adopted,9-0-0,yes,yes,yes,yes,yes,yes,yes,yes,yes,https://cambridgema.iqm2.com/Citizens/Detail_LegiFile.aspx?Frame=&MeetingID=4263&MediaPosition=&ID=19362&CssClass=,"Congratulations to Nailze Lima, MAPS 2023 Mary and Manuel Rogers Lifetime Community Service Award Recipient.",
RES 2023 #147,3,05/15/23 Regular,05/15/23,Congratulations,Adopted,9-0-0,yes,yes,yes,yes,yes,yes,yes,yes,yes,https://cambridgema.iqm2.com/Citizens/Detail_LegiFile.aspx?Frame=&MeetingID=4263&MediaPosition=&ID=19418&CssClass=,"Congratulations to Paul Ferreira, President of East Cambridge Printing Company, MAPS 2023 Alvaro Lima Outstanding Business Award Recipient.",
RES 2023 #148,4,05/15/23 Regular,05/15/23,Congratulations,Adopted,9-0-0,yes,yes,yes,yes,yes,yes,yes,yes,yes,https://cambridgema.iqm2.com/Citizens/Detail_LegiFile.aspx?Frame=&MeetingID=4263&MediaPosition=&ID=19422&CssClass=,Congratulations and thanks to Whitney Mooney for her service to the Cambridge community.,
RES 2023 #149,5,05/15/23 Regular,05/15/23,Death Resolution,Adopted,9-0-0,yes,yes,yes,yes,yes,yes,yes,yes,yes,https://cambridgema.iqm2.com/Citizens/Detail_LegiFile.aspx?Frame=&MeetingID=4263&MediaPosition=&ID=19452&CssClass=,Resolution on the death of John B. Donofrio Jr.,
RES 2023 #150,6,05/15/23 Regular,05/15/23,Happy Birthday Resolution,Adopted,9-0-0,yes,yes,yes,yes,yes,yes,yes,yes,yes,https://cambridgema.iqm2.com/Citizens/Detail_LegiFile.aspx?Frame=&MeetingID=4263&MediaPosition=&ID=19505&CssClass=,Happy Birthday to Artis Spears,
RES 2023 #151,7,05/15/23 Regular,05/15/23,Death Resolution,Adopted,9-0-0,yes,yes,yes,yes,yes,yes,yes,yes,yes,https://cambridgema.iqm2.com/Citizens/Detail_LegiFile.aspx?Frame=&MeetingID=4263&MediaPosition=&ID=19507&CssClass=,Resolution on the Death of James Shearer,
RES 2023 #152,1,05/22/23 Regular,05/22/23,Death Resolution,Adopted,8-0-1,yes,yes,yes,yes,absent,yes,yes,yes,yes,https://cambridgema.iqm2.com/Citizens/Detail_LegiFile.aspx?Frame=&MeetingID=4264&MediaPosition=&ID=19499&CssClass=,Resolution on the death of Arthur Samuel Jarvis.,
RES 2023 #153,2,05/22/23 Regular,05/22/23,Death Resolution,Adopted,8-0-1,yes,yes,yes,yes,absent,yes,yes,yes,yes,https://cambridgema.iqm2.com/Citizens/Detail_LegiFile.aspx?Frame=&MeetingID=4264&MediaPosition=&ID=19554&CssClass=,Resolution on the death of Joseph W. Murphy,
RES 2023 #154,3,05/22/23 Regular,05/22/23,Death Resolution,Adopted,8-0-1,yes,yes,yes,yes,absent,yes,yes,yes,yes,https://cambridgema.iqm2.com/Citizens/Detail_LegiFile.aspx?Frame=&MeetingID=4264&MediaPosition=&ID=19555&CssClass=,Resolution on the death of Mary M. White,
RES 2023 #155,4,05/22/23 Regular,05/22/23,Congratulations,Adopted,8-0-1,yes,yes,yes,yes,absent,yes,yes,yes,yes,https://cambridgema.iqm2.com/Citizens/Detail_LegiFile.aspx?Frame=&MeetingID=4264&MediaPosition=&ID=19556&CssClass=,Congratulations on the birth of Sabrina Reid Roberts,
RES 2023 #156,5,05/22/23 Regular,05/22/23,Congratulations,Adopted,8-0-1,yes,yes,yes,yes,absent,yes,yes,yes,yes,https://cambridgema.iqm2.com/Citizens/Detail_LegiFile.aspx?Frame=&MeetingID=4264&MediaPosition=&ID=19561&CssClass=,Congratulations to Dr. Vikas Saini,
RES 2023 #157,6,05/22/23 Regular,05/22/23,Death Resolution,Adopted,8-0-1,yes,yes,yes,yes,absent,yes,yes,yes,yes,https://cambridgema.iqm2.com/Citizens/Detail_LegiFile.aspx?Frame=&MeetingID=4264&MediaPosition=&ID=19572&CssClass=,Resolution on the death of Terrance Walsh,
RES 2023 #158,7,05/22/23 Regular,05/22/23,Death Resolution,Adopted,8-0-1,yes,yes,yes,yes,absent,yes,yes,yes,yes,https://cambridgema.iqm2.com/Citizens/Detail_LegiFile.aspx?Frame=&MeetingID=4264&MediaPosition=&ID=19573&CssClass=,Resolution on the death of Lisa Aideuis,
RES 2023 #159,8,05/22/23 Regular,05/22/23,Death Resolution,Adopted,8-0-1,yes,yes,yes,yes,absent,yes,yes,yes,yes,https://cambridgema.iqm2.com/Citizens/Detail_LegiFile.aspx?Frame=&MeetingID=4264&MediaPosition=&ID=19575&CssClass=,Resolution on the death of Emily Ruth Tucker,
RES 2023 #160,9,05/22/23 Regular,05/22/23,Death Resolution,Adopted,8-0-1,yes,yes,yes,yes,absent,yes,yes,yes,yes,https://cambridgema.iqm2.com/Citizens/Detail_LegiFile.aspx?Frame=&MeetingID=4264&MediaPosition=&ID=19578&CssClass=,Resolution on the death of Margarita Morehead,
RES 2023 #161,10,05/22/23 Regular,05/22/23,Death Resolution,Adopted,8-0-1,yes,yes,yes,yes,absent,yes,yes,yes,yes,https://cambridgema.iqm2.com/Citizens/Detail_LegiFile.aspx?Frame=&MeetingID=4264&MediaPosition=&ID=19580&CssClass=,Resolution on the death of Mary McKearney,
RES 2023 #162,1,06/05/23 Regular,06/05/23,Death Resolution,Adopted,,,,,,,,,,,https://cambridgema.iqm2.com/Citizens/Detail_LegiFile.aspx?Frame=&MeetingID=4265&MediaPosition=&ID=19581&CssClass=,Resolution on the death of Laura Rauscher.,
RES 2023 #163,2,06/05/23 Regular,06/05/23,Congratulations,Adopted,,,,,,,,,,,https://cambridgema.iqm2.com/Citizens/Detail_LegiFile.aspx?Frame=&MeetingID=4265&MediaPosition=&ID=19676&CssClass=,Congratulations to Maria Ricardo on her 95th Birthday.,
RES 2023 #164,3,06/05/23 Regular,06/05/23,Resolution,Adopted,,,,,,,,,,,https://cambridgema.iqm2.com/Citizens/Detail_LegiFile.aspx?Frame=&MeetingID=4265&MediaPosition=&ID=19678&CssClass=,Thanks to Louis A. Elisa For speaking at Memorial Day Observance.,
RES 2023 #165,4,06/05/23 Regular,06/05/23,Congratulations,Adopted,,,,,,,,,,,https://cambridgema.iqm2.com/Citizens/Detail_LegiFile.aspx?Frame=&MeetingID=4265&MediaPosition=&ID=19684&CssClass=,Thanks to Dr. Jill Kasper for her service at the Cambridge Alliance and best wishes in her future endeavors.,
RES 2023 #166,5,06/05/23 Regular,06/05/23,Resolution,Adopted,,,,,,,,,,,https://cambridgema.iqm2.com/Citizens/Detail_LegiFile.aspx?Frame=&MeetingID=4265&MediaPosition=&ID=19693&CssClass=,Condolences to the Family of Mary-Catherine Deibel,
RES 2023 #167,6,06/05/23 Regular,06/05/23,Congratulations,Adopted,,,,,,,,,,,https://cambridgema.iqm2.com/Citizens/Detail_LegiFile.aspx?Frame=&MeetingID=4265&MediaPosition=&ID=19726&CssClass=,Congratulations to Bishop Brian C. Greene,
RES 2023 #168,7,06/05/23 Regular,06/05/23,Congratulations,Adopted,,,,,,,,,,,https://cambridgema.iqm2.com/Citizens/Detail_LegiFile.aspx?Frame=&MeetingID=4265&MediaPosition=&ID=19727&CssClass=,Congratulations to Erinn Pearson for 21 Years of Simply Erinn's,
RES 2023 #169,8,06/05/23 Regular,06/05/23,Resolution,Adopted,,,,,,,,,,,https://cambridgema.iqm2.com/Citizens/Detail_LegiFile.aspx?Frame=&MeetingID=4265&MediaPosition=&ID=19776&CssClass=,Resolution in Honor of the Day of Portugal,
RES 2023 #170,1,06/12/23 Regular,06/12/23,Congratulations,Adopted,8-0-1,absent,yes,yes,yes,yes,yes,yes,yes,yes,https://cambridgema.iqm2.com/Citizens/Detail_LegiFile.aspx?Frame=&MeetingID=4266&MediaPosition=&ID=18384&CssClass=,Congratulations to Miriam DaSilva on her retirement from the Cambridge Public Schools.,
RES 2023 #171,2,06/12/23 Regular,06/12/23,Congratulations,Adopted,8-0-1,absent,yes,yes,yes,yes,yes,yes,yes,yes,https://cambridgema.iqm2.com/Citizens/Detail_LegiFile.aspx?Frame=&MeetingID=4266&MediaPosition=&ID=19154&CssClass=,Congratulations to Fran Roznowski on her retirement from the Cambridge Public Schools.,
RES 2023 #172,3,06/12/23 Regular,06/12/23,Death Resolution,Adopted,8-0-1,absent,yes,yes,yes,yes,yes,yes,yes,yes,https://cambridgema.iqm2.com/Citizens/Detail_LegiFile.aspx?Frame=&MeetingID=4266&MediaPosition=&ID=19728&CssClass=,Resolution on the death of Gary Maujer Lewis.,
RES 2023 #173,4,06/12/23 Regular,06/12/23,Congratulations,Adopted,8-0-1,absent,yes,yes,yes,yes,yes,yes,yes,yes,https://cambridgema.iqm2.com/Citizens/Detail_LegiFile.aspx?Frame=&MeetingID=4266&MediaPosition=&ID=19790&CssClass=,Congratulations to Darin Cromwell on his retirement from the Cambridge Police Department.,
RES 2023 #174,5,06/12/23 Regular,06/12/23,Death Resolution,Adopted,8-0-1,absent,yes,yes,yes,yes,yes,yes,yes,yes,https://cambridgema.iqm2.com/Citizens/Detail_LegiFile.aspx?Frame=&MeetingID=4266&MediaPosition=&ID=19808&CssClass=,Resolution on the death of Mary Boudreau.,
RES 2023 #175,6,06/12/23 Regular,06/12/23,Congratulations,Adopted,8-0-1,absent,yes,yes,yes,yes,yes,yes,yes,yes,https://cambridgema.iqm2.com/Citizens/Detail_LegiFile.aspx?Frame=&MeetingID=4266&MediaPosition=&ID=19819&CssClass=,City Council thanks to Kaki Martin for her service to the City of Cambridge.,
RES 2023 #176,7,06/12/23 Regular,06/12/23,Congratulations,Adopted as Amended,8-0-1,absent,yes,yes,yes,yes,yes,yes,yes,yes,https://cambridgema.iqm2.com/Citizens/Detail_LegiFile.aspx?Frame=&MeetingID=4266&MediaPosition=&ID=19831&CssClass=,Congratulations to Deputy Superintendent Dr. Carolyn Turk on her retirement from the Cambridge Public Schools.,
RES 2023 #177,8,06/12/23 Regular,06/12/23,Death Resolution,Adopted,8-0-1,absent,yes,yes,yes,yes,yes,yes,yes,yes,https://cambridgema.iqm2.com/Citizens/Detail_LegiFile.aspx?Frame=&MeetingID=4266&MediaPosition=&ID=19833&CssClass=,Resolution on the death of Maria Pacheco.,
RES 2023 #178,1,06/26/23 Regular,06/26/23,Congratulations,Adopted,8-0-1,yes,yes,yes,absent,yes,yes,yes,yes,yes,https://cambridgema.iqm2.com/Citizens/Detail_LegiFile.aspx?Frame=&MeetingID=4267&MediaPosition=&ID=19791&CssClass=,Congratulations on the retirement of Myreille Daniel from the Cambridge Health Alliance.,
RES 2023 #179,2,06/26/23 Regular,06/26/23,Congratulations,Adopted,8-0-1,yes,yes,yes,absent,yes,yes,yes,yes,yes,https://cambridgema.iqm2.com/Citizens/Detail_LegiFile.aspx?Frame=&MeetingID=4267&MediaPosition=&ID=19792&CssClass=,Congratulations on the retirement of Deborah Race from the Cambridge Health Alliance.,
RES 2023 #180,3,06/26/23 Regular,06/26/23,Congratulations,Adopted,8-0-1,yes,yes,yes,absent,yes,yes,yes,yes,yes,https://cambridgema.iqm2.com/Citizens/Detail_LegiFile.aspx?Frame=&MeetingID=4267&MediaPosition=&ID=19794&CssClass=,Congratulations on the retirement of Aurea Siewert from the Cambridge Health Alliance.,
RES 2023 #181,4,06/26/23 Regular,06/26/23,Congratulations,Adopted,8-0-1,yes,yes,yes,absent,yes,yes,yes,yes,yes,https://cambridgema.iqm2.com/Citizens/Detail_LegiFile.aspx?Frame=&MeetingID=4267&MediaPosition=&ID=19795&CssClass=,Congratulations on the retirement of Geslie Thomas from the Cambridge Health Alliance.,
