Unique Identifier,Agenda Number,Meeting,Meeting Date,Sponsor,Co-Sponsors,Charter Right,Amended,Outcome,Type of Vote,Sumbul Siddiqui,Burhan Azeem,Patricia Nolan,Jivan Sobrinho-Wheeler,Catherine Zusy,Marc C. McGovern,E. Denise Simmons,Timothy R. Flaherty,Ayah A. Al-Zubi,Yeas,Nays,Present,Absent,Recused,Link,Summary,Notes
POR 2026-119,1,2026-06-08 Regular,2026-06-08,E. Denise Simmons,"Marc C. McGovern,Timothy R. Flaherty",,,Adopted,Unanimous,,,,,,,,,,,,,,,https://cambridgema.primegov.com/search/itemsearch?searchItemId=87610,"That the City Manager is requested to confer with the Cambridge Historical Commission, the Law Department, the Department of Public Works, Inspectional Services, the Cambridge Public Health Department, Community Preservation Act staff, the Harvard Square Business Association, and the owners of properties abutting the Old Stone Wall, for the purpose of developing a practical plan to stabilize, preserve, and restore this historic resource",
POR 2026-110,1,2026-06-08 Regular,2026-06-08,,,E. Denise Simmons,,Tabled,Voice Vote,,,,,,,,,,,,,,,https://cambridgema.primegov.com/search/itemsearch?searchItemId=87570,Zero Waste Master Plan Ordinance changes,
POR 2026-120,2,2026-06-08 Regular,2026-06-08,E. Denise Simmons,Timothy R. Flaherty,E. Denise Simmons,,Charter Right,,,,,,,,,,,,,,,,https://cambridgema.primegov.com/search/itemsearch?searchItemId=87611,"That the City Manager is requested to confer with the Police Department, the Community Safety Department, the Emergency Communications Department, the Department of Human Service Programs, the Department of Public Works, the Law Department, and any other relevant City departments and community partners to develop a Neighborhood Safety Additions Plan for the areas of the City previously served by ShotSpotter technology",
POR 2026-121,3,2026-06-08 Regular,2026-06-08,Sumbul Siddiqui,"Marc C. McGovern,Jivan Sobrinho-Wheeler,Catherine Zusy,Timothy R. Flaherty",Ayah A. Al-Zubi,,Charter Right,,,,,,,,,,,,,,,,https://cambridgema.primegov.com/search/itemsearch?searchItemId=87627,"That the City Manager is requested to use the Federal Stabilization Fund to provide one-time stabilization payments to Cambridge-based and Cambridge-serving organizations impacted by FY27 MOVA cuts, report back to the City Council with a proposed funding plan, and work with the Mayor's Office and other relevant City staff to engage with the broader Cambridge nonprofit community to assess the full scope of federal and state funding reductions and their impact on the City's safety net services.    CHARTER RIGHT EXERCISED BY COUCILLOR AL-ZUBI IN COUNCIL JUNE 8, 2026",
POR 2026-122,4,2026-06-08 Regular,2026-06-08,Timothy R. Flaherty,E. Denise Simmons,,,Failed,Roll Call,no,no,absent,no,no,no,yes,yes,no,,,,,,https://cambridgema.primegov.com/search/itemsearch?searchItemId=87633,That the City Council shall complete the required review and determinations prescribed by Section 2.128.060(c) before taking any future vote regarding the continued use of ShotSpotter or any other surveillance technology,
POR 2026-123,5,2026-06-08 Regular,2026-06-08,Timothy R. Flaherty,Catherine Zusy,,,Referred,Unanimous,,,,,,,,,,,,,,,https://cambridgema.primegov.com/search/itemsearch?searchItemId=87634,"That the City Manager is requested to direct the Community Development Department, and other relevant City departments, to examine and report back to the City Council with a feasibility analysis with findings, options, and recommendations regarding the following proposed amendments to the multifamily zoning ordinance.    REFERRED TO THE JOINT HOUSING AND NEIGHBORHOOD AND LONG TERM PLANNING COMMITTEE MEETING TO BE HELD ON JUNE 25, 2026",
